["‎Messages and calls are end-to-end encrypted. Only people in this chat can read, listen to, or share them.", "Holaaaaa Ramon tanto tiempo como estas?", "La verdad no he hablado ultimamente con el, pero cualquier cosa estamos atentos! Por mi parte sigo en la misma no mas buscando proyectos o pega", "Estoy buscando en analisis de datos o data science, ese es mi fuerte ya que manejo mas que nada exploracion de datos, aprendizaje de maquina supervisado y no supervisado, deep learning y redes neuronales y algo de big data en python, tambien SQL y ahora empezare a estudiar docker con imagen de postgres", "Con respecto a la busqueda no me ha ido bien, no me han respondido o simplemente me dicen que no calzo con el perfil, aunque ahora habia quedado preseleccionado en una pega de data science para hacer pronostico energetico en una empresa de energia solar, pero no me dicen nada aun del avance en la seleccion de esa pega", "La empresa es una chilena llamada Suncast, la semana pasada tuve una prueba sicologica pero aun espero respuestas", "Siii pero como se han demorado sigo abierto a cualquier proyecto o trabajo en verdad", "Ok enseguida", "‎Voice call, ‎17 min", "https://www.linkedin.com/in/joaquin-lobos-parra?utm_source=share&utm_campaign=share_via&utm_content=profile&utm_medium=android_app", "Hola Ramon, primero gracias de nuevo por la oportunidad que me quieres dar, de verdad se agradece de todo corazon", "Segundo, ya que necesitas a harta gente me gustaria recomendarte a el", "Tiene 3 años de experiencia en aplicaciones", "Las tecnologias que usa son las que me nombraste", "NestJS React JS etc", "Si necesitas sus cv avisame para mandartelo, o si quieres me das tu correo y yo le digo que te lo mande ahi", "Siiii pense lo mismo, justo estudiaron donde mismo", "Le dire a el que te escriba po para que haya conexion directa de una, o te lo mando yo no mas sus cosas y lo contactas despues?", "Ok le dire que te escriba", "Por cierto, la empresa que diriges se llama t4app o nada que ver?", "Wenaaaa super, tienen pagina de linkedin para empesar a seguirlos? 🧐", "Jajaja no hay apuro ahi me manda el link bueno", "Por cierto ya le avise a mi colega de este dato asi que le escribira al mail que me dijo", "Gracias a usted ! Quedo atento al link y a mañana por la llamada", "Igual tengo todo el dia, me avisa si tiene que cambiar de horario por si no puede a la hora que me dijo", "Hola Ramon, yo ando bien y tu? Oye disculpa por no contestar ayer, pasa que a esa hora no estaba en casa y cuando llegue ya era muy tarde y no te queria molestar de noche", "Por su puesto conmigo cuente al 100%, mi amigo el joaquin me comento la situacion y bueno lamento que al final el decidiera escoger la otra opcion ya que de verdad era buena carta, pero bueno yo voy sí o sí a la reu", "Me confirma la hora no mas", "Y estamos", "Wena wena Ramon como estas? Oye te escribo para confirmarte que mañana sí o sí me conecto para nuestra reunion, y además te quiero desear una bonita ultima semana del año, ojala que esta navidad la hayas pasado muy bien con tu familia! Nos vemos mañana", "Por cierto si tengo un par mas en mente pero mañana te comento de sus perfiles profesionales", "Hola Ramon como estas? Quedo atento al link para la reunion", "Mi correo es", "matiasdamianlopezg@gmail.com", "Y tengo zoom, google chat se refiere al google meet? Si no, no tengo el google chat", "Puedo conectarme desde cualquiera de las 2 plataformas", "Ok ahora ingreso", "Estoy dentro por si acaso", "Hola Ramon, solo me gustaria informar que desde las 3 estoy haciendo un informe de la pagina de tech4tms.com, para que lo tengas en cuenta, por ahora lo estoy escribiendo todo en un block de notas, te gustaria que los comentarios lo haga en un word mejor u otra cosa? Quedo atento", "Por ahora te adelanto que al menos por lo que he visto hay detalles con la carga de las cosas, pero principalmente hay detalles con la gramatica de los textos colocados, hartas la verdad", "Ok no hay problema, a lo que termine lo subo y te aviso x aca tambien", "Termine el primer informe de la primera web que me enviaste, tech4tms.com, hice 9 paginas de sugerencia que ahora estoy acomodando en google word para que se entienda y lo subo", "Para tech4shops.com, necesito un mail y password, me sirve el mismo que para el trace.tech4tms.com? El de go2 logistics", "Ok ok super", "Terminare con este primer informe y veo esas", "Dame 1 seg", "Ya Ramon, te mande el informe al canal sql-w-matias del slack", "Ahora pensaba en seguir con las demas revisiones en un rato ya que a esta hora (las 7 aca) vamos a comer con mi familia, habria problemas con eso? Si quieres antes podriamos tener la reunion para que me pases el vpn y asi me pasas la base de datos si gustas", "Hola buenas Ramon como estas? Oye te comento, termine el reporte de go2 logistics que me pediste y te lo mande al slack por el canal de ayer, sql-w-matias", "Sorry x no avisar nada pero me quede pegado haciendo las sugerencias que hice para la visualizacion de los datos y tambien remarcando lo que vi de la plataforma", "Ahora solo me queda hacer el reporte de la web tech4shops.com, ya la vi y solo vi 1 cosa rara no mas asi que demas lo saco rapido", "Y con eso puedo al fin ver sin nada pendiente la base de datos que me ibas a pasar, quedo atento por si quieres tener una reu ahora o por si hay comentarios del segundo reporte", "‎Voice call, ‎38 min", "Ok", "Hola ramon", "Sigo aqui por si quieres estar en llamada", "Chuta ramon sorry por no contestar habia aprovechado de ir a comer ademas de ver lo del tech4inventory", "Si quieres te llamo o me llamas ahora", "Para dejar listo ahora eso del mysql", "Me avisas plisss ya que en una media hora debo salir", "Ya ramon te envie el informe del tech4shops, fue mas corto pero tiene un bug interesante con una subseccion", "Respecto a las horas trabajadas, estas fueron:\n-1 am a 3 am de hoy miercoles \n-2 pm a 5 pm de hoy miercoles\n-8pm a 9 pm de hoy miercoles\nSerian 6 horas las de hoy, entre las 5 y las 8 hay harto espacio porque hablamos harto por telefono y entremedio aproveche de comer tambien 🤣", "Dale dale le pondre empeño a eso", "El road es en ese orden no?", "Obvio se que sql es aparte si", "Wena wena ramon como estas? Oye ya estoy disponible para partir hoy, por si quieres ver lo del mysql", "Ok mientras cargare mi cel", "Oye ramon sabis que estoy teniendo problemas de conexion con vtr por si no contesto 🫥 recien se me fue la internet por 10 minutos, y por mi parte no tengo plan ya que he estado corto como para pagarlo", "Al menos ahora aparece estable pero aviso por si las moscas", "Esta bien se entiende perfectamente, yo me puedo conectar en 5 para terminar de instalar todo", "Nooo me refiero que en 5 minutos", "Ya ramon ahora si", "Ok", "Y siii", "Lo tengo ya", "Ok ahora ingresare", "Buenas ramon ya instale el vscode", "Eso si me aparecio un error de conexion con el remoto", "Habra alguien intentando conectarse igual?", "Ahora volvio", "Wena wena Ramon, primero que todo muy feliz nuevo año! Espero que haya comenzado bacan para ti, queria comentarte que ya comence a trabajar asi que cualquier cosa quedo atento 👁", "Te comento con el query voy bien pero puede mejorar, primero vi que todas las tablas usadas en los left join o en los where estuvieran indexadas para acelerar el proceso de consulta y asi es, todas estan indexadas, lo que hice despues es que una de las funciones COALESCE la re escribi para que demorase menos en hacerse la consulta general y asi fue, baja de 2.1 seg a 1.6 seg, y ahora veo las demas funciones usadas dentro de la consulta a ver si las puedo re escribir o las dejo tal cual", "Lo que quiero hacer ahora es un diagrama para entender mejor la consulta a ver si es mas claro el tipo de cambios que puedo hacer para acelerar el proceso", "Wena wena ramon como estas sigues ahi? Oye sabes ando un poco estancado si bien logre conseguir bajas en las demoras pero igual estoy enredado ya que a veces esas mejoras implica la eliminacion de columnas y eso nose si a veces este bien o mal ya que segun yo eso depende del modelo de negocios", "Me avisas po quedo atento", "Ya que creo seria bueno una reu express xD", "Ooooh Ramon me encantaria tener la reu ahora pero tengo un problema 😬 es que ya son las 10.30 aqui y me habia comprometido para algo ahora a la noche por lo que no estoy en casa, acabo de salir 😬 esa es la verdad, no podemos tener la reu mañana a primera hora? Sorryyyy 🙏🙏🙏🙏", "Super gracias por comprenderme ramon 🙏🏻mañana tengamos la reu temprano si o si po, lo otro es que te debo pedir la app para registrar las horas por si acaso", "Hoy parti a las 13:49 y termine a las 21 ya que despues me fui a comer", "Hola hola ramon como estas? Estoy disponible ya para comenzar por si quieres tener una llamada o lo que sea, quedo atento", "Ok dame 1 segundo me conectare mientras", "Hola ramon por si acaso ya me voy a conectar, seguire probando cambios en la query para ver si la dejo lista hoy", "Ok no hay problema", "Hola ramon como estas? Por si acaso esta vez partire ahora ya que tipo 7 debo salir (son las 12 aca)", "Cualquier cosa estoy atento", "Hola sorry me habia ido a comer recien", "Dime", "MARTES 9: 12.30 A 18.30 -NO FUI A COMER ENTRE MEDIO-\nMIERCOLES 10: 12.45 A 14.10, luego 14.30 A 19.15\nJUEVES 11: 12.11 HASTA LAS 19.15 -NO FUI A COMER ESE DIA ENTRE MEDIO-\nVIERNES 12: DESDE LAS 12 A LAS 13.40, LUEGO DE LAS 14.20 A LAS 19.00", "LUNES 15 (HOY): 12 A 15.45, LUEGO DE 16.05 A 20.00 hrs", "Esto lo saque viendo el skype ojo", "JUEVES: 12.00 a 13.25, luego desde las 14.00 a las 18.45 (6 horas con 10 minutos)\nMIERCOLES: 12.10 a 14.35, luego desde 15.25 a 19.25 (6 horas con 25 minutos) \nMARTES: 12.00 a 13.40, luego desde 14.15 a 18.40 (6 horas con 5 minutos)\n\nNo te habia anotado mis horas del martes ni miercoles 😬 aqui esta lo de la semana, el lunes esta arriba, que corresponde a 7 horas con 40 minutos (todo sacado del skype)", "Nos vemos ramon !", "Hola ramon estas? Oye te hablo por aqui porque hay un mega incendio en donde vivo", "Y cuento corto cortaron la luz en toda mi pobla y por tanto no tengo internet", "Alcance a hacer la parte del mobile para el sales, pero me falta aun\n‎[2/2/24, 4:26:16 PM] Matias LOPEZ: ‎<attached: 00000167-PHOTO-2024-02-02-16-26-16.jpg>", "Ahi me volvio el internet ramon", "Pero anda inestable", "Hola ramon como estas?", "Oye vine a la sucursal de ria a sacar el dinero", "Pero me dijeron que \"el giro no esta disponible para pago\" con ese pin\n‎[2/17/24, 9:52:37 AM] Matias LOPEZ: ‎<attached: 00000175-PHOTO-2024-02-17-09-52-37.jpg>", "Ok quedo atento ramon", "Te lo puedo mandar por aca? Sorry lo que pasa es que ayer fui a retirar el dinero tambien pero pille cerrada la sucursal, y en el viaje lo olvide", "Y ahora no ando en casa vine a valpo a retirar el monto", "Si no hay apuro te lo mando por skype apenas llegue", "La direccion completa es:\nIndico 4530, primer sector gomez carreño, viña del mar, chile", "Address: Indico 4530, Gomez Carreño\nCity: Viña del mar\nProvince: Valparaíso\nCode postal: 2200055\n‎[2/17/24, 10:03:39 AM] Ramon Gajardo: ‎<attached: 00000189-PHOTO-2024-02-17-10-03-39.jpg>", "Jajajja", "Wena ramon", "Oye anoche me salia pin valido y listo para cobrarse\n‎[2/23/24, 8:05:59 AM] Matias LOPEZ: ‎<attached: 00000196-PHOTO-2024-02-23-08-05-59.jpg>", "Pero vine a cobrar el dinero y desde hoy sale asi, y en la pantalla dice no disponible para pago", "‎Voice call, ‎9 min\n‎[2/23/24, 8:17:47 AM] Matias LOPEZ: ‎<attached: 00000199-PHOTO-2024-02-23-08-17-47.jpg>", ".\n‎[2/23/24, 8:24:25 AM] Matias LOPEZ: ‎<attached: 00000201-PHOTO-2024-02-23-08-24-25.jpg>", "Ya ramon ahi se puede", "Saque el dinero", "Los weones raros", "Vamos a tener que hacerles el sistema de 0 🤣", "Hola ramon como estas? Oye sorry x hablar por aca no ando en casa, pero te queria avisar que hoy por fin me cayo el pago\n‎[3/9/24, 12:50:17 PM] Matias LOPEZ: ‎<attached: 00000208-PHOTO-2024-03-09-12-50-17.jpg>", "Hola ramon, oye por si acaso ya termine de comer pero me cortaron el net, reinicie el modem recien asi que estoy esperando a que vuelva", "Ahi volvio\n‎[4/22/24, 12:34:08 PM] Matias LOPEZ: ‎<attached: 00000212-PHOTO-2024-04-22-12-34-08.jpg>\n‎[4/22/24, 12:34:09 PM] Matias LOPEZ: ‎<attached: 00000213-PHOTO-2024-04-22-12-34-09.jpg>", "A mi me sale asi lo de permisos", "Mira al apretar en Ubicacion me sale solo la lista de cosas con permisos o no\n‎[4/22/24, 12:37:08 PM] Matias LOPEZ: ‎<attached: 00000219-PHOTO-2024-04-22-12-37-08.jpg>", "Y tengo eso tambien", "Version 11.0 de android", "Yap seguire en la maquina ramon\n‎[4/22/24, 12:40:03 PM] Matias LOPEZ: ‎<attached: 00000226-STICKER-2024-04-22-12-40-03.webp>\n‎[4/24/24, 10:13:14 AM] Matias LOPEZ: ‎<attached: 00000227-PHOTO-2024-04-24-10-13-14.jpg>\n‎[4/24/24, 10:13:15 AM] Matias LOPEZ: ‎<attached: 00000228-PHOTO-2024-04-24-10-13-15.jpg>\n‎[4/24/24, 10:13:15 AM] Matias LOPEZ: ‎<attached: 00000229-PHOTO-2024-04-24-10-13-15.jpg>", "El celu llego con un detalle en la camara si, pero todo lo demas bien\n‎[4/24/24, 10:13:41 AM] Matias LOPEZ: ‎<attached: 00000231-PHOTO-2024-04-24-10-13-41.jpg>", "Dale hare eso mientras aunque llego con casi toda la carga\n‎[4/24/24, 10:17:58 AM] Matias LOPEZ: ‎<attached: 00000242-PHOTO-2024-04-24-10-17-58.jpg>", "Hola ramon que tal, oye por si acaso he perdido mi conexion internet, hay un temporal y se fue la luz en todo el sector donde vivo", "Ahora te hablo desde mis datos moviles", "Ya hice el poncheo, por si acaso sigo sin luz 😓", "Sigo sin luz aún ramon, el sector entero la tiene cortada\n‎[5/10/24, 10:08:47 AM] Matias LOPEZ: ‎<attached: 00000259-PHOTO-2024-05-10-10-08-47.jpg>", "Me sale asi al ponchear", "Hola ramon como estas? Oye me gustaria pedirte poder entrar media hora mas tarde hoy, pasa que baje a viña a hacer un tramite y demoraron ene en atenderme y recien estoy esperando la micro 😓", "Hola ramon como estas? Oye una consulta, queria saber cuando fue la ultima vez que se hizo un pago? Lo que pasa es que la ultima vez que me llego uno fue el 3 y segun yo el siguiente deberia haberme llegado por el viernes 17 pero aun no me llega la ultima quincena y necesito el dinero", "Hola ramon como estas? Oye te escribo porque la verdad me gustaria pedirte el dia hoy, estoy enfermo del estomago desde ayer pero hoy desperte con un dolor raro como cuando me dio colitis la otra vez y me gustaria ir a verme a ver si me dan ordenes para algun examen en especifico que me pueda servir", "Hola ramon buen dia como estas?, hoy estoy mejor asi que en unos minutos me conecto", "Hola ramon como estas? Oye estoy en la siguiente situacion, se corto la luz en mi zona de nuevo por las lluvias -se supone está pasando un ciclon- asi que ando con el puro celu, mi mamá preguntó a que hora deberia volver y se supone a las 3 pm reparan todo\n‎[6/13/24, 9:45:33 AM] Matias LOPEZ: ‎<attached: 00000280-PHOTO-2024-06-13-09-45-33.jpg>", "Hola! Como estas ramon", "Yo bien, te hable en skype desde hace un rato", "Aaaaaaah con razon", "Ok, pero a partir de la hoja que te comparti ayer?", "Sí demás que sí, entonces tomo las dos hojas del google sheet que te comparti y en python hago el spreadsheet", "Ok", "Y respecto al skype, nos mantenemos comunicando por aca o te hablo al slack mejor?", "Ahi mande otro", "Siii raro la otra vez igual estaba asi", "Hola ramon, oye te habia avisado por skype que me iba mal la conexion e iba a reiniciar, sin embargo lo que tenia cortado no es la internet si no la luz 😶😶 voy a ir a consultar que pasa a conserjeria y vengo ya que estoy al dia con esa cuenta", "Ahora ando con el net movil mientras", "Aun nada ramon, pero al final no fue solo a mi si no que al condominio, sigo esperando por mientras...", "Nop nada ya que no tengo wi fi para ponchear, la luz sigue en la misma, la luz se me fue a las 16.45 mas menos de aca y sin las 18.34", "Ya po me parece, sorry igual por este imprevisto que mala si porque esta todo el edificio igual", "Mas encima en viernes", "Ramon se me fue la conexion recien, yo creo por el temporal", "Voy a ver que me dicen los de vtr", "Esto le llego a mi papá hoy, sigue caida la conexion ramon", "En una se fue la luz incluso", "Hola ramon como estas? Oye pasa lo siguiente, alcance a solucionar el problema que me aparecio ayer al final + las 3 tareas que me diste, estaba haciendo lo ultimo pero se me fue el internet", "Voy a reiniciar a ver que sucede", "Hola ramon oye reinicie mi internet ya que el slack ni el dw me cargan y te estuve mandando mensajes a skype pero parece que no te llegan", "Estoy esperando al router y te aviso para que me muestres como se sube el proyecto", "Hola ramon oye hoy de nuevo mi conexion se cayo, voy a reiniciar el modem para ver si vuelve con eso", "Me habia vuelto pero duro un rato no mas, de nuevo sigo sin conexion ramon, vere si funciona reiniciar otra vez ese modem", "Yo creo que sí preferiré seguir mañana, ya que recien me volvio y logre terminar de implementar la nueva api en el proyecto original, pero se me acaba de ir de nuevo la internet y ya he reiniciado dos veces el modem\n‎[8/28/24, 4:39:40 PM] Matias LOPEZ: ‎<attached: 00000346-PHOTO-2024-08-28-16-39-40.jpg>", "Hola ramon sorry la demora ya que no tenia net habia aprovechado de hacerle clase a mi hermano", "Te llamo?", "Hola ramon como estamos? Oye sorry por empezar con dramas pero pasa que he tenido mala conexion toda la mañana, a ratos vuelve pero despues se cae de nuevo, mi papá que es el titular hizo el reclamo pero solo le enviaron esto:\n‎[8/29/24, 10:32:40 AM] Matias LOPEZ: ‎<attached: 00000355-PHOTO-2024-08-29-10-32-40.jpg>", "Te aviso por si demoro en entrar, yo espero lo solucionen pronto estos locos", "Hola ramon gracias por los buenos deseos, ahora me cayo el pago por si acaso", "Hola ramon oye estoy con el internet caido, tenia un poco de lag denantes pero ahora se cayo por completo, reinicie el modem asi que estoy esperando la respuesta\n‎[10/7/24, 4:27:28 PM] Matias LOPEZ: ‎<attached: 00000365-AUDIO-2024-10-07-16-27-28.opus>", "Ramon ando con problemas de conexion desde hace un momento, voy a reiniciar el modem y vuelvo", "Pucha me habia vuelto (te avise por sky) y se volvio a ir, voy a reiniciar de nuevo", "Ahi volvio, espero ahora este estable, te hable por skype 🫡", "Hola ramon, por si acaso acaba de caerse mi conexion (te escribo con los datos moviles) voy a reiniciar el modem y vuelvo, a ver si me vuelve", "Ramon para variar perdi la conexion 🫠 voy a reiniciar el modem a ver si vuelve pronto o si no voy a llamar ya que es 3era vez en la semana que se me cae la conexion", "Hola ramon sigo aqui, pero pasa que mi net esta completamente inestable asi que voy a reiniciar el modem y llamar a ver si me dan una solucion por sistema al menos", "En el note no tengo net x ahora pero al menos tengo el wi fi del cel", "Hola ramon, perdi la conexion un momento, voy a reiniciar el modem mientras", "Hola síii al final funciono, te habia hablado por skype hace unos minutos ya que sigo implementando lo del docker, pues me encontre con que al parecer la imagen se dejo de mantener y estoy buscando como lo hicieron otros que sí lograron montar la imagen", "Pero ya me llego la net y todo, funciona bien hasta ahora, dw tambien", "Ramon ya vuelvo perdi la conexion, voy a reiniciar el modem y vengo", "La app de android tambien me va rara, al poner my orders o new work orders no pasa nada, solo puedo abrir time clock", "Nop no me funciono y para colmo aprete en algo nada que ver y se me cerro la sesion, estoy buscando las credenciales por eso no respondia\n‎[12/3/24, 9:30:22 AM] Matias LOPEZ: ‎<attached: 00000405-PHOTO-2024-12-03-09-30-22.jpg>", "El iphone nada, no se que le pasa, hasta me da la sensacion que fue hackeado ya que lo tengo cargando, pero se reinicia solo a cada rato y siempre sale en 1% cuando prende", "Pero es imposible que el iphone sea hackeado ya que solo le tengo las apps de que me has pedido testear y ya", "Pero que iba a saber yo que el celu iphone iba a fallar, si todos los dias iba bien, mas encima lo tenia cargando de antes pero me fije en la hora de marcar que se estaba reiniciando a cada rato, ya que mientras tenia que ayudar en ordenar", "Ahi pude marcar !!! Wtf, ya dejo de reiniciarse solo", "Sí eso mismo me estaba diciendo un compa que conoce de iphone, quiza fue una actualizacion que se hizo mientras cargaba", "En todo caso tampoco quiero que se inicie una discusion por el tema, ya que de verdad esto no habia pasado antes con el celular y de hecho no habia tenido problemas con el", "Ya marque y mientras he seguido con las tareas que me diste", "Gracias ! Q tengas buena noche y nos vemos mañana", "Hola ramon q tal, oye se me acaba de ir la luz, voy a llamar a consejeria a ver que onda pasa ahora, ya vuelvo", "Mejor fui a verles, me comentaron que no es de aqui el corte si no que un cable de afuera debe haber fallado pero no los generadores de aca, voy a esperar otro rato a ver que sucede", "Wena ramon espero que estes bien, te escribo para desearte unas bonitas fiestas de fin de año pero sobre todo, para darte las gracias por este año de oportunidad laboral y experiencia que me has dado, hoy 26 de diciembre se cumple un año exacto desde que me ayudaste a abrirme camino en esto de la programacion y me gustaria simplemente decirte que te agradecere siempre por eso, un abrazo a la distancia, saludos a todos y espero lo hayas pasado super ayer, nos vemos el lunes !", "ramon tengo problemas de conexion, reiniciare el modem mientras y me vuelvo a conectar", "Hola ramon, oye sorry pero hubo un cuete en mi casa y se apago todo de la nada", "Ahora volvio la luz pero estoy esperando que llegue la net", "Hola aqui estoy", "Estoy con lo del video", "Te hablare por skype", "Ok mientras editare el video y te lo mando", "Hola ramon oye subi justo el video de prototipo de tutorial al drive de t4crossdock, pero se me acaba de ir la internet asi que reinicie el modem mientras para ver si llega pronto, el video se llama \"Prototipo de tutorial 4\" por si acaso, voy a llamar a los del internet mientras para ver si pasa algo por si acaso", "Hola ramon como estas? Queria saber si al final hoy habra dia libre, o si en cambio entraremos 1 hora despues, ya que el viernes me dijiste que durante el finde ibas a decidir, quedo atento !", "Hola ramon oye tuve un apagon de internet de nuevo, voy a reiniciar mi conexion mientras", "Hola ramon aun nada, y aparte ahora se sumo la luz, pasa que estan haciendo un arreglo general en mi edificio y fui a preguntar y me dijeron que es porque estan haciendo una revision antes de hacer unas instalaciones\n‎[2/13/25, 3:30:41 PM] Matias LOPEZ: ‎<attached: 00000460-PHOTO-2025-02-13-15-30-41.jpg>", "Hola ramon como estas oye disculpa la hora pero como tuve que salir corriendo hoy (y ayer tambien) hay algo que se me ha olvidado pedirte, resulta que tengo un horario de salida mal marcado, es el de la semana pasada cuando se me fue la luz (jueves 13), ese dia no pude marcar el horario de salida y cuando ya volvio la luz me olvide de hacerlo, por lo que marque recien el viernes cuando entré, si me lo puedes arreglar x favor 🙏disculpa por avisar recien pero he tenido unos dias re movidos ultimamente y por eso se me a olvidado completamente avisar eso\n‎[2/18/25, 8:14:23 PM] Matias LOPEZ: ‎<attached: 00000466-PHOTO-2025-02-18-20-14-23.jpg>", "Ahi se puede ver, deberia decir que sali a las 15.00 tuyas el 13 ya que x esa hora se me fue la luz esa vez", "Vale ramon gracias y suerte con eso, nos vemos mañana !", "Hola ramon oye por si acaso se corto la luz en el edificio, pasa que siguen haciendo arreglos como el otro dia y algo debieron pasar a llevar, voy a ir a preguntar que onda y cuanto estaran asi", "Ooooh que raro", "Porque en mi caso si estan haciendo reparaciones jajja\n‎[2/25/25, 12:20:03 PM] Matias LOPEZ: ‎<attached: 00000478-PHOTO-2025-02-25-12-20-03.jpg>", "Pucha no se manda la foto", "Es vdd, ahi se esta hablando en mis grupos de amigos", "Que raro jajja", "https://www.senapred.cl/informate/evento/alteracion-de-suministro-de-electricidad-preliminar", "Por si acaso aun nada, al final es una emergencia nacional\n‎[2/25/25, 2:03:59 PM] Matias LOPEZ: ‎<attached: 00000484-PHOTO-2025-02-25-14-03-59.jpg>", "Supuestamente eso paso (me llego al whatsapp si)", "Ramon perdi mi conexion (por suerte no la luz🤣) asi que reinicie mi modem para ver que sucede, ya vuelvo", "Hola ramón, yo estoy bien y tú? Disculpa la demora pero andaba fuera de casa", "Respecto a esto gracias por la info. Sera entonces toda la semana o algunos dias?", "Y bueno por si no nos vemos esta semana, recordarte avisarle a greg por lo de las horas que no me conto de esta quincena please, ya que me vendran bien en la que sigue jajaj", "Suerte en tu salida de la ciudad !", "Hola ramon, oye por si acaso se me fue la luz asi que perdi la conexion a net, voy a ver que pasa con el concerje ya que parece fue en todo el edificio, ya vuelvo", "Hola ahi regreso, parece que hubo un accidente donde pasaron a llevar un poste cerca, pero ahi regreso\n‎[3/25/25, 9:16:49 AM] Matias LOPEZ: ‎<attached: 00000503-AUDIO-2025-03-25-09-16-49.opus>", "Hola ramon consulta, al final hoy cual era la hora de salida? Es que te hable hace unos minutos pero como sales desconectado nose si es por lo del partido o porque estas ocupado 🙀", "Por si acaso deje marcado ya que ayer recuerdo que me mencionaste que saldrias a las 2 en tu horario 👀 lo que alcance hoy fue añadir la seccion que agrega proyectos, quede en la personalizacion para el panel de los dev, y me falta manipular un poco mas el html base para dejar mejor las cosas visualmente, cualquier cosa estoy atento", "Jajajja chuta que mal y sorry por saturarte", "Oye entonces el horario de salida era normal? Que estoy seguro que me dijiste que saldrias antes por lo del partido y como asumi que te habias ido a ver eso marque el horario de salida tambien 😬😬😬 pero puedo terminar de comer y volver si es que al final el horario es normal", "Dale ramon nos vemos mañana entonces nos vemos mañana! Disfruta el partido y ojala que asi sea y gane la U po 😁", "Hola ramon como estas? Espero que bien, oye te escribo para ver si es posible pedir el dia de hoy libre, pasa que volvi a recaer ayer en fiebre y no me siento nada bien hoy 🤢 mas que nada x el dolor de cabeza y la cantidad de flemas que boto, ahora quiero ir a comprar unos remedios por aqui cerca pero estare atento x si acaso", "Vale muchas gracias ramon, yo creo que para mañana ya deberia estar mejor, te estoy avisando que tengas un buen lunes !!!", "Hola ramon como estas? Espero que bien, oye si no es molestia me gustaria pedirte al final el dia de hoy tambien, ya que la jaqueca se me fue pero tengo una congestion nivel dios, ya para mañana deberia estar mejor si o al menos presentable para no perder mas horas, cualquier cosa estoy atento !", "Hola ramon como estas? Sorry x no responder ayer pero la fiebre me tenia re incomodo y preferi reposar, te comento que ayer me fue bien, para controlar la jaqueca horrible que tenia me inyectaron un analgesico, pero para la fiebre me resetaron Broncotusilan que es un jarabe que me ayudo bastante ya que hoy me siento mejor, asi que hoy fijo me conecto por si las moscas", "Hola", "Síii lo hice no encontraba el celu lo tenia mi mamá y x eso demore en ponchear", "Pero ya lo hice 😁", "Hola ramon por si acaso ya esta el reporte, pero sufri una caida de conexion asi que por eso no te habia podido avisar, estoy reiniciando mi conexion y llamando a vtr ya que ayer pague la cuenta, como para ver que pasa", "https://www.instagram.com/reel/C9KbDWfhsbZ/?igsh=c2RiZzA2M3NmYmh2", "Hola ramon como estas? Espero que todo bien, oye te escribia x lo siguiente, por el temporal la parte electrica de mi edificio sufrio un corte total denantes y tienen cortada la luz, fui a preguntar y me dijeron que tienen para rato ya que tendra que venir un tecnico a ver pero el tipo agendo venir para despues de almuerzo, quisiera saber entonces, dado que no tendre luz por un buen rato, si me puedo tomar el dia? Ya que ese rato muerto lo quiero aprovechar para solucionar otros problemas que tuve durante el finde, quedo atento!", "‎Voice call, ‎Answered on other device", "Te escucho muy bajo en el microfono", "https://www.linkedin.com/in/mat%C3%ADas-l%C3%B3pez-a07bb212b?utm_source=share&utm_campaign=share_via&utm_content=profile&utm_medium=android_app\n‎[6/20/25, 4:37:52 PM] Matias LOPEZ: ‎<attached: 00000545-PHOTO-2025-06-20-16-37-52.jpg>\n‎[6/23/25, 7:10:50 PM] Matias LOPEZ: ‎<attached: 00000546-VIDEO-2025-06-23-19-10-50.mp4>\n‎[6/24/25, 12:22:07 PM] Matias LOPEZ: ‎<attached: 00000547-VIDEO-2025-06-24-12-22-07.mp4>\n‎[6/24/25, 1:25:02 PM] Matias LOPEZ: ‎<attached: 00000548-VIDEO-2025-06-24-13-25-02.mp4>\n‎[6/24/25, 6:55:13 PM] Matias LOPEZ: ‎<attached: 00000549-PHOTO-2025-06-24-18-55-13.jpg>\n‎[6/30/25, 5:41:00 PM] Matias LOPEZ: ‎<attached: 00000550-VIDEO-2025-06-30-17-41-00.mp4>\n‎[7/1/25, 1:20:49 PM] Matias LOPEZ: ‎<attached: 00000551-VIDEO-2025-07-01-13-20-49.mp4>\n‎[7/1/25, 6:40:47 PM] Matias LOPEZ: ‎<attached: 00000552-VIDEO-2025-07-01-18-40-47.mp4>\n‎[7/7/25, 2:47:46 PM] Matias LOPEZ: ‎<attached: 00000553-VIDEO-2025-07-07-14-47-46.mp4>\n‎[7/10/25, 1:14:20 PM] Matias LOPEZ: ‎<attached: 00000554-VIDEO-2025-07-10-13-14-20.mp4>", "‎[7/11/25, 12:30:31 PM] Matias LOPEZ: ‎<attached: 00000556-VIDEO-2025-07-11-12-30-31.mp4>\n‎[7/11/25, 12:32:52 PM] Matias LOPEZ: ‎<attached: 00000557-VIDEO-2025-07-11-12-32-52.mp4>", "Hola ramon como estas? Espero que bien, sere directo, te escribia para saber si puedo pedirte el dia, pasa que el finde sali y me pegue un resfriado para variar y la verdad es que hoy no amaneci bien, tengo una fiebre alta y la verdad me gustaria reposar para recomponerme lo antes posible, quedo atento", "Gracias ! Nos vemos mañana 🙏", "Ramon se me cayo el net recien 😪 creo que por el temporal", "Estoy desde el wi fi del cel ahora", "Hola ramon sorry estaba intentando arreglar la net reiniciando el modem", "Pero nada", "Aparte a veces como que da la sensacion que se va luz jajja", "Ok, gracias x la preocupacion, si me puedes ponchar tu please porque llame a conserjeria y no saben nada de nada de la conexion", "Hola ramon, bien y tu como estas? Justo te iba a escribir, pasa que nos pasaron un comunicado desde el grupo de mi condominio avisando que habra un corte de luz en el condominio, de 12 a 16 hrs, esto porque anoche los generadores comenzaron a fallar y hoy se llamo al tecnico para que viniera a revisarlos, pero segun nos dice conserjeria le tomara mas o menos ese tiempo si viene hoy, por lo mismo queria saber si te podia pedir el dia ya que mas encima podria alargarse, te mando el comunicado", "📢 AVISO IMPORTANTE – GÓMEZ CARREÑO, VIÑA DEL MAR\n\nVecinas y vecinos, debido al fuerte temporal que afecta a la Región de Valparaíso, se realizará un corte preventivo de energía eléctrica en el sector.\n\n⏰ Horario: desde las 12:00 hrs hasta las 16:00 hrs de hoy.\n⚡ Motivo: medidas de seguridad por ráfagas de viento y lluvias intensas.\n\n🔎 La Superintendencia de Electricidad y Combustibles (SEC) informó que más de 48 mil clientes ya se encuentran sin suministro en distintas comunas debido a este sistema frontal, y las distribuidoras están aplicando planes de contingencia junto a la Subsecretaría de Energía y Subtel.\n\n👉 Recomendaciones:\n\nDesconectar equipos eléctricos sensibles.\n\nTener linternas y pilas a mano.\n\nResguardar agua y alimentos básicos.\n\nMantenerse informado por canales oficiales.\n\nGracias por su comprensión y prevención.", "Ahi me avisas, quedo atento", "Vale ramon nos vemos el lunes mucho exito este finde !", "Hola ramon estas? Te habia hablado hace un rato para avisarte que ya me iba, deje listo el diccionario de Venditio LLC, te pregunto por aqui porque no me apareces como conectado en slack", "Por si acaso deje poncheado ya que tengo que hacer, nos vemos mañana ramon exito !", "Si po, a las 8 te mande 2 diccionarios pero a las 8.20 me tuve que desconectar ya que tenia que ir a buscar una encomienda a la puerta de mi edificio", "No te llegaron los mensajes?", "Oooh que mal por lo del internet, pero la cosa es que te mande el diccionario de DIAMOND LOGISTICS que fue el que pude arreglar y despues te mande el de CHAMPION LOGISTICS que pude terminar justo a la hora", "Siii gracias por preguntar era una loza que pidio mi mama pero tuve que ir a buscarlas yo ya que eran 2 cajas pesadas jajjaj", "Entendible ramon, disculpa por no avisar aqui pero no me imagine que tenias problemas de internet asi que asumi que te habian llegado los mensajes !\n‎[9/17/25, 8:03:40 AM] Matias LOPEZ: ‎<attached: 00000615-AUDIO-2025-09-17-08-03-40.opus>", "Hola ramon por si acaso ya llegue, te hable por el slack pero nose si te llego mi mensaje", "Hola ramon espero que estes bien, primero que todo disculpas por escribir tan tarde pero me ocurrio una situacion mala que me gustaria no fuese real, cuento corto mi amigo al que fui a ver por razones medicas la otra vez fallecio ayer (miercoles), por eso escribo tan tarde ya que fui a dar el apañe despues de que me avisaron a la familia y amigos, y me vine recien a la casa a descansar, la cosa es que me gustaria pedirte el dia de hoy (jueves) ya que  quiero ir al funeral de mi amigo a despedirlo como corresponde, pido disculpas si suena raro todo pero estoy expresandome lo mejor que puedo en este momento y se que el mes anterior pedi permiso por lo mismo pero creeme que a mi tambien me gustaria que fuese mentira esto, en fin buenas noches y quedo atento a tu respuesta", "Hola ramon como estas? Espero que bien, ramon, si es posible me gustaria pedirte el dia otra vez, ayer fue un dia muy tenso para mi y hoy no amaneci bien, en especifico me enferme del estomago desde anoche y he dormido pesimo, asi que si es posible retomar desde el lunes te lo agradecere, estoy atento", "Ramon perdi mi conexion voy a reiniciar el modem mientras", "Ya me volvio la conexion x si acaso", "Hola ramon, lo mismo de ayer, se cayo mi internet, voy a reiniciar el modem y aprovechare de llamar a la compañia para ver que pasa", "Hola ramon ya solucione el tema, me voy a reconectar al slack"]